JORGE DAVID RODRIGUEZ PEREZ,[{u'date_from': u'2013-11-18', u'title': u'Presidente', u'name': u'Piscicola De Trebujena SA', u'date_to': u'2016-08-04'}, {u'date_from': u'2013-11-18', u'title': u'Consejero', u'name': u'Piscicola De Trebujena SA', u'date_to': u'2016-08-04'}, {u'title': u'Consejero', u'name': u'Trebujena Emprende SL', u'date_to': u'2018-04-24'}, {u'title': u'Vicepresid.', u'name': u'Trebujena Emprende SL', u'date_to': u'2018-04-24'}, {u'date_from': u'2018-04-24', u'title': u'Consejero', u'name': u'Trebujena Emprende SL', u'date_to': u'2018-04-24'}, {u'date_from': u'2018-04-24', u'title': u'Vicepresid.', u'name': u'Trebujena Emprende SL', u'date_to': u'2018-04-24'}, {u'date_from': u'2018-04-24', u'title': u'Presidente', u'name': u'Trebujena Emprende SL', u'date_to': u'2018-04-24'}, {u'date_from': u'2018-04-24', u'title': u'Consejero', u'name': u'Trebujena Emprende SL', u'date_to': u'2018-04-24'}, {u'date_from': u'2018-04-24', u'title': u'Presidente', u'name': u'Trebujena Emprende SL', u'date_to': u'2018-04-24'}, {u'date_from': u'2018-04-24', u'title': u'Consejero', u'name': u'Trebujena Emprende SL', u'date_to': u'2018-04-24'}],[{u'date_from': u'2014-06-24', u'name': u'Suintresa Suelo Urbano E Industrial Trebujena SA', u'title': u'Liquidador'}, {u'date_from': u'2018-04-24', u'name': u'Trebujena Emprende SL', u'title': u'Presidente'}, {u'date_from': u'2018-04-24', u'name': u'Trebujena Emprende SL', u'title': u'Consejero'}],<open file 'resultados.csv', mode 'a' at 0x7fe970944300>,IULV-CA,Trebujena
ISABEL GOMEZ GARCIA,[],[{u'date_from': u'2012-09-27', u'name': u'Finca Los Llanos SL', u'title': u'Adm. Mancom.'}, {u'date_from': u'2012-12-31', u'name': u'Gestion Horman SL', u'title': u'Adm. Unico'}, {u'date_from': u'2012-12-31', u'name': u'Ferrallas El Cid SL', u'title': u'Adm. Mancom.'}, {u'date_from': u'2013-04-15', u'name': u'Ch4 Soluciones Energeticas SL', u'title': u'Adm. Unico'}, {u'date_from': u'2017-04-05', u'name': u'Caritransvalencia SL', u'title': u'Adm. Unico'}],<open file 'resultados.csv', mode 'a' at 0x7fe970944660>,P.S.O.E.-A,Ubrique
ALFONSO CARLOS MOSCOSO GONZALEZ,[{u'title': u'Consejero', u'name': u'Aguas De La Sierra De Cadiz SA', u'date_to': u'2012-10-02'}, {u'date_from': u'2011-10-25', u'title': u'Consejero', u'name': u'Turismo Gaditano SA', u'date_to': u'2015-12-02'}],[],<open file 'resultados.csv', mode 'a' at 0x7fe970944300>,P.S.O.E.-A,Villaluenga del Rosario
JUAN LUIS MORALES GALLARDO,[{u'date_from': u'2012-10-02', u'title': u'Consejero', u'name': u'Aguas De La Sierra De Cadiz SA', u'date_to': u'2016-06-09'}],[],<open file 'resultados.csv', mode 'a' at 0x7fe970944300>,PA,Villamartín
JUAN MARIA NIETO SANCHEZ,[],[{u'date_from': u'2016-06-09', u'name': u'Aguas De La Sierra De Cadiz SA', u'title': u'Presidente'}, {u'date_from': u'2016-06-09', u'name': u'Aguas De La Sierra De Cadiz SA', u'title': u'Consejero'}, {u'date_from': u'2017-01-19', u'name': u'Aguas De La Sierra De Cadiz SA', u'title': u'Con.Delegado'}, {u'date_from': u'2018-06-21', u'name': u'Basuras Sierra De Cadiz SA', u'title': u'Presidente'}, {u'date_from': u'2018-06-21', u'name': u'Basuras Sierra De Cadiz SA', u'title': u'Consejero'}],<open file 'resultados.csv', mode 'a' at 0x7fe970944300>,PSOE-A,Zahara
AMALIA ROMERO BENITEZ,[{u'title': u'Consejero', u'name': u'Monte De Piedad Y Caja De Ahorros San Fernando De Huelva, Jerez Y Sevilla ', u'date_to': u'2009-07-29'}],[{u'date_from': u'2009-07-29', u'name': u'Monte De Piedad Y Caja De Ahorros San Fernando De Huelva, Jerez Y Sevilla ', u'title': u'Vpr.Com.Ctr'}, {u'date_from': u'2009-07-29', u'name': u'Monte De Piedad Y Caja De Ahorros San Fernando De Huelva, Jerez Y Sevilla ', u'title': u'Miem.Com.Ctr'}, {u'date_from': u'2012-11-20', u'name': u'Bcv Servicios Municipales SL', u'title': u'Presidente'}, {u'date_from': u'2012-11-20', u'name': u'Bcv Servicios Municipales SL', u'title': u'Consejero'}, {u'date_from': u'2013-07-01', u'name': u'Bcv Servicios Municipales SL', u'title': u'Con.Delegado'}],<open file 'resultados.csv', mode 'a' at 0x7fe970944300>,P.S.O.E.-A,Benalup-Casas Viejas
ANTONIO GONZALEZ CARRETERO,[],[{u'date_from': u'2017-06-02', u'name': u'Explotaciones Agrarias Valderrega\xf1a SL', u'title': u'Consejero'}, {u'date_from': u'2017-06-02', u'name': u'Explotaciones Agrarias Valderrega\xf1a SL', u'title': u'Cons.Del.Sol'}],<open file 'resultados.csv', mode 'a' at 0x7fe970944300>,P.S.O.E.-A,San José del Valle
